"Record ID","Title","Subject","Institution","Journal","Publisher","Country","RetractionDate","RetractionDOI","RetractionPubMedID","OriginalPaperDate","OriginalPaperDOI","OriginalPaperPubMedID","Reason","Notes","Year"
64542,"Models for evaluating the resource integration capability of textile enterprise with hesitant fuzzy uncertain linguistic information","(B/T) Business - Manufacturing;(B/T) Data Science;(B/T) Technology;","School of Cotton Textiles, Tianjin Polytechnic University, Tianjin, China; College of Information Science and Engineering, Hebei North University, Zhangjiakou, China;","Journal of Intelligent & Fuzzy Systems","IOS Press (bought by Sage November 2023)","China",2025-04-17,"10.1177/10641246251331509",0,"7/29/2016 0:00","10.3233/jifs-16216",0,"Computer-Aided Content or Computer-Generated Content;Concerns/Issues about Referencing/Attributions;Concerns/Issues about Third Party Involvement;Compromised Peer Review;Investigation by Journal/Publisher;Investigation by Third Party;Paper Mill;Unreliable Results and/or Conclusions;","ACM information page for the original article: https://dl.acm.org/doi/10.3233/JIFS-16216 See also: https://pubpeer.com/publications/3D6017272264E5E1B516C499DEF332","2025"
64541,"Models for evaluating the benefit risk and performance of internet financial product with triangular fuzzy information","(B/T) Business - Economics;(B/T) Computer Science;","Economics & Management School, Chongqing Normal University, Chongqing, China;","Journal of Intelligent & Fuzzy Systems","IOS Press (bought by Sage November 2023)","China",2025-04-17,"10.1177/10641246251331509",0,"6/10/2019 0:00","10.3233/jifs-179244",0,"Computer-Aided Content or Computer-Generated Content;Concerns/Issues about Referencing/Attributions;Concerns/Issues about Third Party Involvement;Compromised Peer Review;Investigation by Journal/Publisher;Investigation by Third Party;Paper Mill;Unreliable Results and/or Conclusions;","See also: https://pubpeer.com/publications/B32A3DE4713C028AF0A17BFA154ABA","2025"
64537,"Model for software quality evaluation with hesitant fuzzy uncertain linguistic information","(B/T) Computer Science;(B/T) Technology;","School of Software Engineering, Chongqing University of Arts and Sciences, Yongchuan, China; Institute of Decision Sciences, School of Economics and Management, Chongqing University of Arts and Sciences, Yongchuan, China;","Journal of Intelligent & Fuzzy Systems","IOS Press (bought by Sage November 2023)","China",2025-04-17,"10.1177/10641246251331509",0,"1/1/2014 0:00","10.3233/ifs-130934",0,"Computer-Aided Content or Computer-Generated Content;Concerns/Issues about Referencing/Attributions;Concerns/Issues about Third Party Involvement;Compromised Peer Review;Investigation by Journal/Publisher;Investigation by Third Party;Paper Mill;Unreliable Results and/or Conclusions;","See also: https://pubpeer.com/publications/FB150825D590C05D8C74EB1599F9B5","2025"
64535,"Model for evaluating the Technological Innovation Capability in High-tech Enterprises with Fuzzy Number Intuitionistic Fuzzy Information","(B/T) Business - Management;(B/T) Computer Science;(B/T) Technology;","School of Management, Huazhong University of Science and Technology, Wuhan, China;","Journal of Intelligent & Fuzzy Systems","IOS Press (bought by Sage November 2023)","China",2025-04-17,"10.1177/10641246251331509",0,"10/1/2017 0:00","10.3233/jifs-161812",0,"Computer-Aided Content or Computer-Generated Content;Concerns/Issues about Referencing/Attributions;Concerns/Issues about Third Party Involvement;Compromised Peer Review;Investigation by Journal/Publisher;Investigation by Third Party;Paper Mill;Unreliable Results and/or Conclusions;","ACM information page for the original article: https://dl.acm.org/doi/abs/10.3233/JIFS-161812 See also: https://pubpeer.com/publications/26C27861DC8DE926F7852B7DD88A4D","2025"
64534,"Model for evaluating the teaching effect of the college English public speaking course under the flipped classroom hybrid teaching mode with intuitionistic trapezoidal fuzzy numbers","(B/T) Computer Science;(SOC) Education;","School of Foreign Languages, Shanxi Datong University, Datong, Shanxi, P.R. China;","Journal of Intelligent & Fuzzy Systems","IOS Press (bought by Sage November 2023)","China",2025-04-17,"10.1177/10641246251331509",0,"6/21/2019 0:00","10.3233/jifs-179268",0,"Computer-Aided Content or Computer-Generated Content;Concerns/Issues about Referencing/Attributions;Concerns/Issues about Third Party Involvement;Compromised Peer Review;Investigation by Journal/Publisher;Investigation by Third Party;Paper Mill;Unreliable Results and/or Conclusions;","See also: https://pubpeer.com/publications/F313D2E27A0125502AAFF5E4914B33","2025"
64517,"Model for evaluating the service quality of elderly institutions with hesitant fuzzy linguistic information","(B/T) Computer Science;(HSC) Medicine - General;(HSC) Medicine - Geriatric;","Ningbo College of Health Sciences, Ningbo, China;","Journal of Intelligent & Fuzzy Systems","IOS Press (bought by Sage November 2023)","China",2025-04-17,"10.1177/10641246251331509",0,"6/17/2019 0:00","10.3233/jifs-179260",0,"Computer-Aided Content or Computer-Generated Content;Concerns/Issues about Referencing/Attributions;Concerns/Issues about Third Party Involvement;Compromised Peer Review;Investigation by Journal/Publisher;Investigation by Third Party;Paper Mill;Unreliable Results and/or Conclusions;","See also: https://pubpeer.com/publications/6AC3103AB1FD940614311BAEAFE6CF","2025"
64516,"Model for evaluating the operation performance of high-tech zone technology business incubator network with pythagorean fuzzy information","(B/T) Business - Management;(B/T) Computer Science;","School of Management, Wuhan University of Technology, Wuhan, Hubei, China; School of Innovation and Entrepreneurship, South-Central University for Nationalities, Wuhan, Hubei, China; School of Management, South-Central University for Nationalities, Wuhan, Hubei, China; College of Post and Tele Communications and Information Engineering, Wuhan Institute of Technology, Wuhan, Hubei, China;","Journal of Intelligent & Fuzzy Systems","IOS Press (bought by Sage November 2023)","China",2025-04-17,"10.1177/10641246251331509",0,"6/7/2019 0:00","10.3233/jifs-179231",0,"Computer-Aided Content or Computer-Generated Content;Concerns/Issues about Referencing/Attributions;Concerns/Issues about Third Party Involvement;Compromised Peer Review;Investigation by Journal/Publisher;Investigation by Third Party;Paper Mill;Unreliable Results and/or Conclusions;","See also: https://pubpeer.com/publications/A21F9BE731F3816D4B323E2991B14E","2025"
64515,"Model for evaluating the microdefects of textile composites with picture fuzzy information","(B/T) Computer Science;(PHY) Materials Science;","School of Cotton Textiles, Tianjin Polytechnic University, Tianjin, China; College of Information Science & Engineering, Hebei North University, Zhangjiakou, China;","Journal of Intelligent & Fuzzy Systems","IOS Press (bought by Sage November 2023)","China",2025-04-17,"10.1177/10641246251331509",0,"6/19/2019 0:00","10.3233/jifs-179266",0,"Computer-Aided Content or Computer-Generated Content;Concerns/Issues about Referencing/Attributions;Concerns/Issues about Third Party Involvement;Compromised Peer Review;Investigation by Journal/Publisher;Investigation by Third Party;Paper Mill;Unreliable Results and/or Conclusions;","See also: https://pubpeer.com/publications/BCF1487405CF45F641BE393F79B1E0","2025"
64514,"Model for evaluating the international competitiveness of financial system with fuzzy number intuitionistic fuzzy information","(B/T) Business - Economics;(B/T) Computer Science;","School of Finance, Zhongnan University of Economics and Law, Wuhan, Hubei, China;","Journal of Intelligent & Fuzzy Systems","IOS Press (bought by Sage November 2023)","China",2025-04-17,"10.1177/10641246251331509",0,"12/1/2017 0:00","10.3233/jifs-161059",0,"Computer-Aided Content or Computer-Generated Content;Concerns/Issues about Referencing/Attributions;Concerns/Issues about Third Party Involvement;Compromised Peer Review;Investigation by Journal/Publisher;Investigation by Third Party;Paper Mill;Unreliable Results and/or Conclusions;","ACM information page for the original article: https://dl.acm.org/doi/10.3233/JIFS-161059 See also: https://pubpeer.com/publications/CB7B80141CAD212CF8CF03D6D43B79","2025"
64508,"Model for evaluating the high-tech industry competitiveness of science and technology parks with fuzzy number intuitionistic fuzzy information","(B/T) Business - Management;(B/T) Computer Science;","Business School, Hohai University, Nanjing, Jiangsu, China; Economics and Management School, Nanjing Polytechnic Institute, Nanjing, Jiangsu, China; Economics and Management School, Nan Tech University, Nanjing, Jiangsu, China;","Journal of Intelligent & Fuzzy Systems","IOS Press (bought by Sage November 2023)","China",2025-04-17,"10.1177/10641246251331509",0,"10/1/2017 0:00","10.3233/jifs-16294",0,"Computer-Aided Content or Computer-Generated Content;Concerns/Issues about Referencing/Attributions;Concerns/Issues about Third Party Involvement;Compromised Peer Review;Investigation by Journal/Publisher;Investigation by Third Party;Paper Mill;Unreliable Results and/or Conclusions;","ACM information page for the original article: https://dl.acm.org/doi/10.3233/JIFS-16294 See also: https://pubpeer.com/publications/D33BFC04E552035E38E103B8045595","2025"
64507,"Model for evaluating the enterprise marketing capability with picture fuzzy information","(B/T) Business - Management;(B/T) Business - Marketing;(B/T) Computer Science;","School of Economics and Management, Qingdao University of Science & Technology, Qingdao, Shandong, China; School of Business, Liaocheng University, Liaocheng, Shandong, China; School of Economics, Ocean University of China, Qingdao, Shandong, China;","Journal of Intelligent & Fuzzy Systems","IOS Press (bought by Sage November 2023)","China",2025-04-17,"10.1177/10641246251331509",0,"12/1/2017 0:00","10.3233/jifs-161741",0,"Computer-Aided Content or Computer-Generated Content;Concerns/Issues about Referencing/Attributions;Concerns/Issues about Third Party Involvement;Compromised Peer Review;Investigation by Journal/Publisher;Investigation by Third Party;Paper Mill;Unreliable Results and/or Conclusions;","See also: https://pubpeer.com/publications/5ED4CF682EAFA2D97E01BB1F505F78","2025"
64505,"Model for evaluating the electrical power system safety with hesitant fuzzy linguistic information","(B/T) Computer Science;(B/T) Technology;(PHY) Engineering - Electrical;","North China Electric Power University, Beijing, China;","Journal of Intelligent & Fuzzy Systems","IOS Press (bought by Sage November 2023)","China",2025-04-17,"10.1177/10641246251331509",0,"10/5/2015 0:00","10.3233/ifs-141462",0,"Computer-Aided Content or Computer-Generated Content;Concerns/Issues about Referencing/Attributions;Concerns/Issues about Third Party Involvement;Compromised Peer Review;Investigation by Journal/Publisher;Investigation by Third Party;Paper Mill;Unreliable Results and/or Conclusions;","ACM information page for the original article: https://dl.acm.org/doi/10.3233/ifs-141462 See also: https://pubpeer.com/publications/72E0009DC04897F16731F6DD2C470D","2025"
64504,"Model for art effect evaluation of fashion photography with triangular intuitionistic fuzzy information","(B/T) Computer Science;(HUM) Arts - General;","School of Fashion, Dalian Polytechnic University, Dalian, Liaoning, China;","Journal of Intelligent & Fuzzy Systems","IOS Press (bought by Sage November 2023)","China",2025-04-17,"10.1177/10641246251331509",0,"6/10/2019 0:00","10.3233/jifs-179226",0,"Computer-Aided Content or Computer-Generated Content;Concerns/Issues about Referencing/Attributions;Concerns/Issues about Third Party Involvement;Compromised Peer Review;Investigation by Journal/Publisher;Investigation by Third Party;Paper Mill;Unreliable Results and/or Conclusions;","See also: https://pubpeer.com/publications/C1ABE4B78CA7B66D2C8395AB5ABF5A","2025"
64481,"Methods for technical innovation efficiency evaluation of high-tech industry with picture fuzzy set","(B/T) Business - General;(B/T) Computer Science;","School of Innovation and Entrepreneurship, Harbin University of Commerce, Harbin, Heilongjiang, China;","Journal of Intelligent & Fuzzy Systems","IOS Press (bought by Sage November 2023)","China",2025-04-17,"10.1177/10641246251331509",0,"6/12/2019 0:00","10.3233/jifs-179229",0,"Computer-Aided Content or Computer-Generated Content;Concerns/Issues about Referencing/Attributions;Concerns/Issues about Third Party Involvement;Compromised Peer Review;Investigation by Journal/Publisher;Investigation by Third Party;Paper Mill;Unreliable Results and/or Conclusions;","See also: https://pubpeer.com/publications/60D0E8B2C3BC41E2CAE2A695F2937C","2025"
64480,"Methods for evaluating the government administrative power under the whole area tourism with hesitant fuzzy linguistic information","(B/T) Business - General;(B/T) Computer Science;(B/T) Government;","Business School, Guangxi University, Nanning, China;","Journal of Intelligent & Fuzzy Systems","IOS Press (bought by Sage November 2023)","China",2025-04-17,"10.1177/10641246251331509",0,"6/18/2019 0:00","10.3233/jifs-179264",0,"Computer-Aided Content or Computer-Generated Content;Concerns/Issues about Referencing/Attributions;Concerns/Issues about Third Party Involvement;Compromised Peer Review;Investigation by Journal/Publisher;Investigation by Third Party;Paper Mill;Unreliable Results and/or Conclusions;","See also: https://pubpeer.com/publications/F81079D0ACF8C3E8F8EEB527433A9A","2025"
64479,"Methodology for building material suppliers selection based on the intuitionistic fuzzy multiple attribute decision making method","(B/T) Business - Management;(B/T) Business - Manufacturing;(B/T) Computer Science;","School of Civil Engineering, Chongqing University of Arts and Sciences, Chongqing, China;","Journal of Intelligent & Fuzzy Systems","IOS Press (bought by Sage November 2023)","China",2025-04-17,"10.1177/10641246251331509",0,"8/25/2022 0:00","10.3233/jifs-221869",0,"Computer-Aided Content or Computer-Generated Content;Concerns/Issues about Referencing/Attributions;Concerns/Issues about Third Party Involvement;Compromised Peer Review;Investigation by Journal/Publisher;Investigation by Third Party;Paper Mill;Unreliable Results and/or Conclusions;",NA,"2025"
64477,"Method for education value evaluation with regional culture integration into international students’ ideological education under fuzzy number intuitionistic fuzzy environment","(B/T) Computer Science;(B/T) Technology;(SOC) Education;(SOC) Political Science;(SOC) Sociology;","School of International Education, Yiwu Industrial & Commercial College, Yiwu, Zhejiang, China;","Journal of Intelligent & Fuzzy Systems","IOS Press (bought by Sage November 2023)","China",2025-04-17,"10.1177/10641246251331509",0,"10/21/2022 0:00","10.3233/jifs-222651",0,"Computer-Aided Content or Computer-Generated Content;Concerns/Issues about Referencing/Attributions;Concerns/Issues about Third Party Involvement;Compromised Peer Review;Investigation by Journal/Publisher;Investigation by Third Party;Paper Mill;Unreliable Results and/or Conclusions;","See also: https://pubpeer.com/publications/F1D9C37DFB427D015C9BEBCA8A4853","2025"
64476,"Metaverse-oriented visual art quality enhancement strategies: a field architecture design and fuzzy assessment theory perspective","(B/T) Technology;(HUM) Arts - General;","School of Art & Design, Shaanxi University of Science & Technology, Xi’an, Shaanxi Province, China;","Journal of Intelligent & Fuzzy Systems","IOS Press (bought by Sage November 2023)","China",2025-04-17,"10.1177/10641246251331509",0,"7/13/2023 0:00","10.3233/jifs-224571",0,"Computer-Aided Content or Computer-Generated Content;Concerns/Issues about Referencing/Attributions;Concerns/Issues about Third Party Involvement;Compromised Peer Review;Investigation by Journal/Publisher;Investigation by Third Party;Paper Mill;Unreliable Results and/or Conclusions;","ACM information page for the original article: https://dl.acm.org/doi/10.3233/JIFS-224571","2025"
64463,"Medical diagnosis based on lattice ordered q-rung linear diophantine fuzzy hypersoft matrices","(B/T) Computer Science;(B/T) Data Science;(B/T) Technology;(HSC) Medicine - General;","Department of Mathematics, Alagappa University, Karaikudi, Tamil Nadu, India;","Journal of Intelligent & Fuzzy Systems","IOS Press (bought by Sage November 2023)","India",2025-04-17,"10.1177/10641246251331509",0,"5/3/2024 0:00","10.3233/jifs-219414",0,"Computer-Aided Content or Computer-Generated Content;Concerns/Issues about Referencing/Attributions;Concerns/Issues about Third Party Involvement;Compromised Peer Review;Investigation by Journal/Publisher;Investigation by Third Party;Paper Mill;Unreliable Results and/or Conclusions;",NA,"2025"
64461,"Mathematical calculation of COVID-19 disease in Pakistan by emergency response modeling based on complex Pythagorean fuzzy information","(B/T) Computer Science;(B/T) Data Science;(B/T) Technology;(HSC) Medicine - Infectious Disease;(HSC) Public Health and Safety;","Department of Mathematics, Shaheed Benazir Bhutto University Sheringal, Pakistan; Department of Mathematics, Abdul Wali Khan University Mardan, Pakistan;","Journal of Intelligent & Fuzzy Systems","IOS Press (bought by Sage November 2023)","Pakistan",2025-04-17,"10.1177/10641246251331509",0,"5/11/2022 0:00","10.3233/jifs-212160",0,"Computer-Aided Content or Computer-Generated Content;Concerns/Issues about Referencing/Attributions;Concerns/Issues about Third Party Involvement;Compromised Peer Review;Investigation by Journal/Publisher;Investigation by Third Party;Paper Mill;Unreliable Results and/or Conclusions;",NA,"2025"
64453,"Linear diophantine multi-fuzzy soft similarity measures: An analysis on alternative-fuel","(B/T) Computer Science;(B/T) Data Science;(B/T) Technology;","Department of Mathematics, Alagappa University, Karaikudi, Tamil Nadu, India;","Journal of Intelligent & Fuzzy Systems","IOS Press (bought by Sage November 2023)","India",2025-04-17,"10.1177/10641246251331509",0,"4/30/2024 0:00","10.3233/jifs-219415",0,"Computer-Aided Content or Computer-Generated Content;Concerns/Issues about Referencing/Attributions;Concerns/Issues about Third Party Involvement;Compromised Peer Review;Investigation by Journal/Publisher;Investigation by Third Party;Paper Mill;Unreliable Results and/or Conclusions;",NA,"2025"
64415,"Intuitionistic fuzzy induced ordered weighted averaging distance operator and its application to decision making","(B/T) Business - Management;(PHY) Mathematics;","School of Business, Ningbo University, Ningbo, China; Manchester Business School, University of Manchester, Manchester, UK; Department of Business Administration, Universitat Politècnica de Valencia, Spain; Hangzhou College of Commerce, Zhejiang Gongshang University, Hangzhou, China; College of Computer and Information, Zhejiang Wanli University, Ningbo, China;","Journal of Intelligent & Fuzzy Systems","IOS Press (bought by Sage November 2023)","China;Spain;United Kingdom",2025-04-17,"10.1177/10641246251331509",0,"11/10/2016 0:00","10.3233/jifs-141219",0,"Computer-Aided Content or Computer-Generated Content;Concerns/Issues about Referencing/Attributions;Concerns/Issues about Third Party Involvement;Compromised Peer Review;Investigation by Journal/Publisher;Investigation by Third Party;Paper Mill;Unreliable Results and/or Conclusions;","ACM information page for the original article: https://dl.acm.org/doi/abs/10.3233/JIFS-141219 See also: https://pubpeer.com/publications/A1EA10D8B281B0FEE751B1B388A261","2025"
64414,"Intuitionistic fuzzy I-convergent double sequence spaces defined by compact operator and modulus function","(PHY) Mathematics;","Department of Mathematics, Aligarh Muslim University, Aligarh, India;","Journal of Intelligent & Fuzzy Systems","IOS Press (bought by Sage November 2023)","India",2025-04-17,"10.1177/10641246251331509",0,"12/1/2017 0:00","10.3233/jifs-17741",0,"Computer-Aided Content or Computer-Generated Content;Concerns/Issues about Referencing/Attributions;Concerns/Issues about Third Party Involvement;Compromised Peer Review;Investigation by Journal/Publisher;Investigation by Third Party;Paper Mill;Unreliable Results and/or Conclusions;","ACM information page for the original article: https://dl.acm.org/doi/10.3233/JIFS-17741","2025"
64413,"Interval-valued Pythagorean Fuzzy EDAS method: An Application to Car Selection Problem","(PHY) Mathematics;","Department of Industrial Engineering, Istanbul Technical University, Management Faculty, Macka, Istanbul, Turkey;","Journal of Intelligent & Fuzzy Systems","IOS Press (bought by Sage November 2023)","Turkey",2025-04-17,"10.1177/10641246251331509",0,"3/30/2020 0:00","10.3233/jifs-182667",0,"Computer-Aided Content or Computer-Generated Content;Concerns/Issues about Referencing/Attributions;Concerns/Issues about Third Party Involvement;Compromised Peer Review;Investigation by Journal/Publisher;Investigation by Third Party;Paper Mill;Unreliable Results and/or Conclusions;","ACM information page for the original article: https://dl.acm.org/doi/abs/10.3233/JIFS-182667","2025"
64412,"Interval-valued pointwise sustaining degree fuzzy reasoning methods based on the left-continuous t-representable t-norms","(PHY) Mathematics;","Department of Information and Computing Science, China Jiliang University, Hangzhou, PR China;","Journal of Intelligent & Fuzzy Systems","IOS Press (bought by Sage November 2023)","China",2025-04-17,"10.1177/10641246251331509",0,"3/9/2022 0:00","10.3233/jifs-211076",0,"Computer-Aided Content or Computer-Generated Content;Concerns/Issues about Referencing/Attributions;Concerns/Issues about Third Party Involvement;Compromised Peer Review;Investigation by Journal/Publisher;Investigation by Third Party;Paper Mill;Unreliable Results and/or Conclusions;","ACM information page for the original article: https://dl.acm.org/doi/abs/10.3233/JIFS-211076","2025"
64411,"Interval-valued intuitionistic fuzzy CODAS method and its application to wave energy facility location selection problem","(PHY) Mathematics;","Department of Industrial Engineering, Istanbul Technical University, Macka, Besiktas, Istanbul, Turkey;","Journal of Intelligent & Fuzzy Systems","IOS Press (bought by Sage November 2023)","Turkey",2025-04-17,"10.1177/10641246251331509",0,"9/1/2018 0:00","10.3233/jifs-18979",0,"Computer-Aided Content or Computer-Generated Content;Concerns/Issues about Referencing/Attributions;Concerns/Issues about Third Party Involvement;Compromised Peer Review;Investigation by Journal/Publisher;Investigation by Third Party;Paper Mill;Unreliable Results and/or Conclusions;","See also: https://pubpeer.com/publications/9890C3447AA3A88070270BDF39E5A2","2025"
64409,"Interval-valued 2-tuple hesitant fuzzy linguistic term set and its application in multiple attribute decision making","(B/T) Data Science;","Business School, Sichuan University, Chengdu, China; School of Information, Zhejiang University of Finance and Economics, Hangzhou, Zhejiang, China; Universitat Politècnica de València, C/ Camí de Vera s/n, Valencia, Spain;","Journal of Intelligent & Fuzzy Systems","IOS Press (bought by Sage November 2023)","China;Spain",2025-04-17,"10.1177/10641246251331509",0,"6/22/2018 0:00","10.3233/jifs-171967",0,"Computer-Aided Content or Computer-Generated Content;Concerns/Issues about Referencing/Attributions;Concerns/Issues about Third Party Involvement;Compromised Peer Review;Investigation by Journal/Publisher;Investigation by Third Party;Paper Mill;Unreliable Results and/or Conclusions;",NA,"2025"
64407,"Interaction hamy mean operators for complex pythagorean fuzzy information and their applications to security threats in computers","(B/T) Computer Science;","School of Mathematics, Thapar Institute of Engineering and Technology (Deemed University), Patiala, Punjab, India; Department of Mathematics, Graphic Era Deemed to be University, Dehradun, India; Applied Science Research Center, Applied Science Private University, Amman, Jordan; Istanbul Technical University, Industrial Engineering Department, Macka, Istanbul, Turkey; Department of Mathematics and Statistics, International Islamic University Islamabad, Pakistan;","Journal of Intelligent & Fuzzy Systems","IOS Press (bought by Sage November 2023)","India;Jordan;Pakistan;Turkey",2025-04-17,"10.1177/10641246251331509",0,"10/19/2022 0:00","10.3233/jifs-220947",0,"Computer-Aided Content or Computer-Generated Content;Concerns/Issues about Referencing/Attributions;Concerns/Issues about Third Party Involvement;Compromised Peer Review;Investigation by Journal/Publisher;Investigation by Third Party;Paper Mill;Unreliable Results and/or Conclusions;","ACM information page for the original article: https://dl.acm.org/doi/abs/10.3233/JIFS-220947 See also: https://pubpeer.com/publications/557C1F459A4D811EF0F76AB7565FB5","2025"
