"Record ID","Title","Subject","Institution","Journal","Publisher","Country","RetractionDate","RetractionDOI","RetractionPubMedID","OriginalPaperDate","OriginalPaperDOI","OriginalPaperPubMedID","Reason","Notes","Year"
62732,"Intelligent dynamic spectrum access using fuzzy logic in cognitive radio networks","(B/T) Computer Science;(B/T) Data Science;(B/T) Technology;(PHY) Engineering - Electrical;(SOC) Communications;","Department of Electronics and Communication, Vasavi College of Engineering, Hyderabad, 500031, Telangana, India; Department of Electronics and Communication Engineering, SR University, Warangal, 506371, Telangana, India; Computer Science and Information Systems Department, College of Applied Sciences, AlMaarefa University, Riyadh, Saudi Arabia; Department of Digital Anti-Aging Healthcare, Inje University, Gimhae, 50834, Republic of Korea; Model Institute of Engineering and Technology, Jammu, J&K, India; Asghar Mall College Rawalpindi, Higher Education Department (HED), Govt. of the Punjab, Rawalpindi, Pakistan; University of Mines and Technology (UMaT), Tarkwa, Ghana;","Discover Applied Sciences","Springer - Nature Publishing Group","Ghana;India;Pakistan;Saudi Arabia;South Korea",2024-12-16,"10.1007/s42452-024-06428-6",0,"1/20/2024 0:00","10.1007/s42452-024-05641-7",0,"Author Unresponsive;Concerns/Issues about Article;Concerns/Issues about Referencing/Attributions;Concerns/Issues about Peer Review;Compromised Peer Review;Investigation by Journal/Publisher;Unreliable Results and/or Conclusions;",NA,"2024"
62731,"Non-sample fuzzy based convolutional neural network model for noise artifact in biomedical images","(B/T) Computer Science;(B/T) Data Science;(B/T) Technology;(HSC) Medicine - General;(HSC) Radiology/Imaging;","Department of Digital Anti-Aging Healthcare, Inje University, Gimhae, 50834, Republic of Korea; Shri Ram Institute of Technology, Jabalpur, India; Department of Information Technology, Dr Vithalrao Vikhe Patil College of Engineering, Ahmednagar, Maharashtra, India; The Department of Tax and Taxation, Tashkent Institute of Finance, Tashkent, Uzbekistan; United International University, Dhaka, Bangladesh; Computer Science and Information Systems Department, College of Applied Sciences, AlMaarefa University, Riyadh, Saudi Arabia; Mahatma Gandhi Institute of Technology Gandipet, Hyderabad, India;","Discover Applied Sciences","Springer - Nature Publishing Group","Bangladesh;India;Saudi Arabia;South Korea;Uzbekistan",2024-12-16,"10.1007/s42452-024-06436-6",0,"1/20/2024 0:00","10.1007/s42452-024-05634-6",0,"Author Unresponsive;Concerns/Issues about Article;Concerns/Issues about Referencing/Attributions;Concerns/Issues about Peer Review;Compromised Peer Review;Investigation by Journal/Publisher;Rogue Editor;Unreliable Results and/or Conclusions;",NA,"2024"
62715,"Multidimensional fuzzy norms and cut sets in the context of medical decision making","(B/T) Computer Science;(HSC) Medicine - General;(PHY) Mathematics;(PHY) Statistics;","Department of Mathematics, National Institute of Technology Calicut, Kozhikode, Kerala, 673601, India;","Discover Applied Sciences","Springer - Nature Publishing Group","India",2025-01-09,"10.1007/s42452-025-06464-w",0,"8/15/2023 0:00","10.1007/s42452-023-05448-y",0,"Concerns/Issues about Article;Concerns/Issues about Referencing/Attributions;Concerns/Issues about Peer Review;Compromised Peer Review;Investigation by Journal/Publisher;Objections by Author(s);Rogue Editor;Unreliable Results and/or Conclusions;",NA,"2025"
62697,"An interactive neutrosophic programming approach for multi objective crop planning problem with intuitionistic fuzzy parameter in Ariyalur District","(B/T) Data Science;(BLS) Agriculture;","Vellore Institute of Technology, School of Advanced Science, Mathematics, Chennai, India;","Journal of Intelligent & Fuzzy Systems","IOS Press (bought by Sage November 2023)","India",2024-08-23,"10.3233/JIFS-219433",0,"9/22/2022 0:00","10.3233/jifs-220156",0,"Compromised Peer Review;Investigation by Journal/Publisher;Investigation by Third Party;","An earlier publication date of the original article can be found in: https://dl.acm.org/doi/abs/10.3233/JIFS-220156","2024"
62694,"An integrated framework for spherical fuzzy MAGDM and applications to english blended teaching quality evaluation","(B/T) Computer Science;(B/T) Data Science;(SOC) Education;","School of Architecture and Planning, Jiujiang University, Jiujiang, Jiangxi, China;","Journal of Intelligent & Fuzzy Systems","IOS Press (bought by Sage November 2023)","China",2024-08-23,"10.3233/JIFS-219433",0,"2/14/2024 0:00","10.3233/jifs-233458",0,"Compromised Peer Review;Investigation by Journal/Publisher;Investigation by Third Party;","An earlier publication date of the original article can be found in: https://dl.acm.org/doi/abs/10.3233/JIFS-233458 See also: https://pubpeer.com/publications/18B36861E90E10465F1191F1A84D85","2024"
62691,"An improved loci method for outlier detection in fuzzy datasets based on fractional distance metric and outlierness degree","(B/T) Computer Science;(PHY) Statistics;","Department of OR, Shiraz University of Technology, Iran; Department of Mathematics, Faculty of Science, University of PayamNoor Shiraz, Iran;","Journal of Intelligent & Fuzzy Systems","IOS Press (bought by Sage November 2023)","Iran",2024-08-23,"10.3233/JIFS-219433",0,"4/18/2024 0:00","10.3233/jifs-234448",0,"Compromised Peer Review;Investigation by Journal/Publisher;Investigation by Third Party;","An earlier publication date of the original article is suggested by: https://www.semanticscholar.org/paper/An-improved-loci-method-for-outlier-detection-in-on-Hajiloei-Jahromi/a0268202c5baa03a0915552e90b4c7fbb450cc79","2024"
62622,"Fuzzy C-means robust algorithm for nonlinear systems","(B/T) Computer Science;","Faculty of Information Technology, Ton Duc Thang University, Ho Chi Minh City, Vietnam; Faculty of Information Technology, University of California, Irvine, United States; Faculty of Industrial Engineering, King Abdulaziz University, Jeddah, 21589, Saudi Arabia;","Soft Computing","Springer - Nature Publishing Group","Saudi Arabia;United States;Vietnam",2023-12-21,"10.1007/s00500-023-09588-6",0,"4/17/2021 0:00","10.1007/s00500-021-05655-y",0,"Author Unresponsive;Concerns/Issues about Authorship/Affiliation;Concerns/Issues about Data;Duplication of Data;Error in Text;Euphemisms for Duplication;Euphemisms for Plagiarism;Plagiarism of Data;Unreliable Data;","See also: https://pubpeer.com/publications/05E2DC3F66AC387A5F59E61000A2E2","2023"
62620,"Improving secured ID-based authentication for cloud computing through novel hybrid fuzzy-based homomorphic proxy re-encryption","(B/T) Computer Science;(B/T) Technology;","Department of CSE, AVS Engineering College, Tamil Nadu, Salem, 636003, India; Department of Computer Science, College of Sciences and Arts in Sarat Abidah, King Khalid University, Abha, Saudi Arabia; Department of CSE, Kongu Engineering College, Perundurai, Tamil Nadu, India; Department of CSE, K.S Rangasamy College of Technology, Tamil Nadu, Tiruchengode, 637415, India; Department of CSE, Mahendra Institute of Technology, Namakkal, Tamil Nadu, India; Department of Computer Science and Engineering, Sree Sakthi Engineering College, Tamil Nadu, Coimbatore, 641104, India; Department of Computer Science, Wenzhou-Kean University, Wenzhou, 325060, China;","Soft Computing","Springer - Nature Publishing Group","China;India",2024-08-08,"10.1007/s00500-024-10024-6",0,"7/6/2020 0:00","10.1007/s00500-020-05119-9",0,"Author Unresponsive;Concerns/Issues about Referencing/Attributions;Concerns/Issues about Peer Review;Compromised Peer Review;Investigation by Journal/Publisher;Objections by Author(s);Rogue Editor;Unreliable Results and/or Conclusions;","See also: https://pubpeer.com/publications/0BD04AF3197FFFB5128A07BC24A203","2024"
62619,"Optimization using the firefly algorithm of ensemble neural networks with type-2 fuzzy integration for COVID-19 time series prediction","(B/T) Computer Science;(B/T) Data Science;(HSC) Medicine - Infectious Disease;","Tijuana Institute of Technology, Tijuana, Mexico;","Soft Computing","Springer - Nature Publishing Group","Mexico",2024-07-22,"10.1007/s00500-024-09995-3",39847673,"1/13/2021 0:00","10.1007/s00500-020-05549-5",33456340,"Concerns/Issues about Referencing/Attributions;Concerns/Issues about Results and/or Conclusions;Concerns/Issues about Peer Review;Compromised Peer Review;Investigation by Journal/Publisher;Objections by Author(s);Rogue Editor;Unreliable Results and/or Conclusions;",NA,"2024"
62488,"Fuzzy clustering-based skyline query preprocessing algorithm for large-scale flow data analysis","(B/T) Computer Science;(B/T) Data Science;","College of Electrical and Information Engineering, Hunan University, Changsha, 410082, Hunan Province, China; College of Computer Science and Electronic Engineering, Hunan University, Changsha, 410082, Hunan Province, China;","The Journal of Supercomputing","Springer - Nature Publishing Group","China",2024-02-12,"10.1007/s11227-024-05979-0",0,"8/11/2018 0:00","10.1007/s11227-018-2523-2",0,"Concerns/Issues about Article;Concerns/Issues about Referencing/Attributions;Concerns/Issues about Peer Review;Compromised Peer Review;Investigation by Journal/Publisher;Unreliable Results and/or Conclusions;","See also: https://pubpeer.com/publications/B7447785FB4292BC2F0FDAB0291FF8","2024"
62443,"AI-enhanced forecasting of Indian primary energy demand: Fuzzy auto-regressive distributed lag models","(B/T) Data Science;(PHY) Energy;","Department of Information Science and Engineering, NMAM Institute of Technology-Affiliated (NITTE (Deemed to be University), Nitte, Karnataka, India; Department of Computer Science and Engineering, IES College of Technology Bhopal, Madhya Pradesh, India; Department of CSE, Srinivasa Ramanujan Institute of Technology (Autonomous), Anantapur, Andhra Pradesh, India; Department of Computing Technologies, School of Computing, SRM Institute of Science and Technology, Kattankulathur, Chennai, India; Department of Computer Science and Business Systems, Panimalar Engineering College, Chennai, India; Department of Electronics and Communication Engineering, Mohan Babu University, Erstwhile Sree Vidyanikethan Engineering College, Tirupati, Andhra Pradesh, India; Department of CSE, KL University, Guntur, Andhra Pradesh, India; Department of Computer Science and Engineering, Sri Venkatasa Perumal College of Engineering and Technology, Puttur, India; Department of CSE, Sri Venkatesa Perumal College of Engineering and Technology, Puttur, Andhra Pradesh, India;","Journal of Intelligent & Fuzzy Systems","IOS Press (bought by Sage November 2023)","India",2024-08-23,"10.3233/JIFS-219433",0,"3/1/2024 0:00","10.3233/jifs-240729",0,"Compromised Peer Review;Investigation by Journal/Publisher;Investigation by Third Party;","Publication date on the IOS retraction notice is 12/27/2024. An earlier date is estimated from: https://www.researchgate.net/publication/379010563_AI-enhanced_forecasting_of_Indian_primary_energy_demand_Fuzzy_auto-regressive_distributed_lag_models","2024"
62426,"FRHO: Fuzzy rule-based hybrid optimization for optimal cluster head selection and enhancing quality of service in wireless sensor network","(B/T) Data Science;(B/T) Technology;","Department of Computer Science and Engineering, Sri Sai Ram Engineering College, Anna University, Chennai, India;","The Journal of Supercomputing","Springer - Nature Publishing Group","India",2024-07-24,"10.1007/s11227-024-06372-7",0,"3/9/2023 0:00","10.1007/s11227-023-05106-5",0,"Author Unresponsive;Concerns/Issues about Image;Concerns/Issues about Referencing/Attributions;Investigation by Journal/Publisher;Unreliable Results and/or Conclusions;","See also: https://pubpeer.com/publications/9A6804A93ADD770195A201BBCEF809","2024"
62420,"Interval-valued dual hesitant fuzzy linguistic group recommendation method by considering the double relevance","(B/T) Data Science;(SOC) Psychology;","School of Economics and Management, Yanshan University, Qinhuangdao, 066004, China;","Applied Intelligence","Springer - Nature Publishing Group","China",2024-12-13,"10.1007/s10489-024-06179-2",0,"3/24/2022 0:00","10.1007/s10489-022-03461-z",0,"Author Unresponsive;Concerns/Issues about Referencing/Attributions;Compromised Peer Review;Investigation by Journal/Publisher;Rogue Editor;Unreliable Results and/or Conclusions;","See also: https://pubpeer.com/publications/2410BD723082189CA2B2F33A0ADC47","2024"
62410,"Adaptive prototype selection algorithm for fuzzy monotonic K-nearest neighbor","(B/T) Computer Science;(B/T) Data Science;(PHY) Mathematics;","School of Control and Computer Engineering, North China Electric Power University, Beijing, China; School of Mathematics and Physics, North China Electric Power University, Beijing, China; Hebei Key Laboratory of Machine Learning and Computational Intelligence, College of Mathematics and Information Science, Hebei University, Baoding, Hebei, China;","Journal of Intelligent & Fuzzy Systems","IOS Press (bought by Sage November 2023)","China",2024-08-23,"10.3233/jifs-219433",0,"4/17/2024 0:00","10.3233/jifs-236643",0,"Compromised Peer Review;Investigation by Journal/Publisher;Investigation by Third Party;","The retraction notice page was finalized on Dec. 27, 2024.","2024"
62405,"A framework to evaluate the barriers for adopting the internet of medical things using the extended generalized TODIM method under the hesitant fuzzy environment","(B/T) Technology;(HSC) Medicine - General;(HSC) Public Health and Safety;","Department of Computer Science and Artificial Intelligence, College of Computer Science and Engineering, University of Jeddah, Jeddah, 23890, Saudi Arabia; School of Economics and Management, Southeast University, Nanjing, 211189, Jiangsu, China;","Applied Intelligence","Springer - Nature Publishing Group","China;Saudi Arabia",2025-01-20,"10.1007/s10489-024-06187-2",0,"2/7/2022 0:00","10.1007/s10489-021-03078-8",0,"Concerns/Issues about Article;Concerns/Issues about Referencing/Attributions;Compromised Peer Review;Investigation by Journal/Publisher;Rogue Editor;Unreliable Results and/or Conclusions;","See also: https://pubpeer.com/publications/3905400266D9F417AD9DCF98237E7C","2025"
62398,"Online education satisfaction assessment based on cloud model and fuzzy TOPSIS","(B/T) Data Science;(SOC) Education;","College of Science, Jimei University, Xiamen, Fujian, 361021, China; College of Mathematics and Finance, Putian University, Putian, Fujian, 351100, China; College of Computer and Cyber Security, Fujian Normal University, Fuzhou, Fujian, 350117, China;","Applied Intelligence","Springer","China",2024-12-13,"10.1007/s10489-024-06176-5",0,"3/5/2022 0:00","10.1007/s10489-022-03289-7",35280109,"Author Unresponsive;Concerns/Issues about Referencing/Attributions;Compromised Peer Review;Investigation by Journal/Publisher;Objections by Author(s);Rogue Editor;Unreliable Results and/or Conclusions;","See also: https://pubpeer.com/publications/F125003C00C5581F88E42629071513","2024"
62375,"Confidence level based complex polytopic fuzzy Einstein aggregation operators and their application to decision-making process","(PHY) Mathematics;","Department of Mathematics, Shaheed Benazir Bhutto University Sheringal, Dir Upper, 1800, Pakistan; Department of Electrical Engineering, Imam Khomeini Naval Science University of Nowshahr, Nowshahr, Iran; Innovation Center for Artificial Intelligence Applications, Yuan Ze University, Taoyuan, Taiwan; Applied Science Research Center, Applied Science Private University, Amman, Jordan;","Scientific Reports","Springer - Nature Publishing Group","Iran;Jordan;Pakistan;Taiwan",2025-01-21,"10.1038/s41598-025-86717-1",39838094,"7/2/2024 0:00","10.1038/s41598-024-65679-w",38956256,"Author Unresponsive;Concerns/Issues about Authorship/Affiliation;Concerns/Issues about Article;Euphemisms for Plagiarism;Investigation by Journal/Publisher;Objections by Author(s);Plagiarism of/in Article;",NA,"2025"
62373,"A study on coopetition using bipolar fuzzy bunch graphs","(B/T) Business - General;(B/T) Computer Science;(B/T) Data Science;(B/T) Technology;","Department of Mathematics, Guru Ghasidas Vishwavidyalaya (A Central University), Bilaspur, India; Department of Mathematics, Tamralipta Mahavidyalaya, Tamluk, India; Research Center of Performance and Productivity Analysis, Istinye University, Istanbul, Türkiye; Chinmaya Vishwa Vidyapeeth, Kerala, India; Department of Humanities and Management, Amrita University, Bangalore, India;","Journal of Intelligent & Fuzzy Systems","IOS Press (bought by Sage November 2023)","India;Turkey",2024-08-23,"10.3233/jifs-219433",0,"3/1/2024 0:00","10.3233/jifs-234061",0,"Compromised Peer Review;Investigation by Journal/Publisher;Investigation by Third Party;",NA,"2024"
62370,"A stacked architecture-based fuzzy classifier with data position transformation using fuzzy cognitive maps","(B/T) Computer Science;(B/T) Data Science;(PHY) Mathematics;","School of Control Science and Engineering, Dalian University of Technology, Dalian, Liaoning, China;","Journal of Intelligent & Fuzzy Systems","IOS Press (bought by Sage November 2023)","China",2024-08-23,"10.3233/jifs-219433",0,"1/10/2024 0:00","10.3233/jifs-236087",0,"Compromised Peer Review;Investigation by Journal/Publisher;Investigation by Third Party;",NA,"2024"
62367,"A research on an improved fuzzy approximate entropy algorithm for EMG-based shoulder and neck muscle fatigue detection","(B/T) Computer Science;(B/T) Technology;(HSC) Medicine - Orthopedics;","Department of Physical Science and Technology, Wuhan University, Wuhan, China; Department of Electrical Engineering and Automation, Wuhan University, Wuhan, China; Chengdu Jiaxiang Foreign Language School, Chengdu, China; College of Engineering, University of Wisconsin-Madison, Madison, United States;","Journal of Intelligent & Fuzzy Systems","IOS Press (bought by Sage November 2023)","China;United States",2024-08-23,"10.3233/JIFS-219433",0,"4/18/2024 0:00","10.3233/jifs-237293",0,"Compromised Peer Review;Investigation by Journal/Publisher;Investigation by Third Party;","Original article and an earlier publication date can be found at: https://www.semanticscholar.org/paper/Fuzzy-Approximate-Entropy-Analysis-of-Chaotic-and-Xie-Guo/c9ab6454a20084e974719ca32521496aace2a7ee","2024"
62352,"A novel intuitionistic fuzzy rough set model and its application to enhance umami peptide prediction","(B/T) Data Science;(BLS) Biochemistry;(PHY) Mathematics;","Department of Computer Science and Engineering, Jaypee University of Engineering & Technology Guna (M.P.), India;","Journal of Intelligent & Fuzzy Systems","IOS Press (bought by Sage November 2023)","India",2024-08-23,"10.3233/JIFS-219433",0,"7/21/2022 0:00","10.3233/jifs-212987",0,"Compromised Peer Review;Investigation by Journal/Publisher;Investigation by Third Party;",NA,"2024"
62340,"A new extension of fuzzy decision by opinion score method based on Fermatean fuzzy: A benchmarking COVID-19 machine learning methods","(B/T) Computer Science;(B/T) Data Science;(B/T) Technology;(HSC) Medicine - Infectious Disease;","Computer Science Department, College of Computer Science and Mathematics, Tikrit University (TU), Tikrit, Iraq; Informatics Institute, Istanbul Technical University, Istanbul, Turkey; Computer Science Department, College of Computer Science and Information Technology, University of Wasit, Wasit, Iraq;","Journal of Intelligent & Fuzzy Systems","IOS Press (bought by Sage November 2023)","Iraq;Turkey",2024-08-23,"10.3233/jifs-219433",0,"7/21/2022 0:00","10.3233/jifs-220707",0,"Compromised Peer Review;Investigation by Journal/Publisher;Investigation by Third Party;","See also: https://pubpeer.com/publications/8108A505B21AEB185C1D5C4FC563EF","2024"
62339,"A neuro-fuzzy approach for multipoint data prediction in passive clustered wireless sensor networks","(B/T) Computer Science;(B/T) Data Science;(B/T) Technology;(SOC) Communications;","Department of Electronics and Communication Engineering, SCAD College of Engineering and Technology, Tirunelveli, India; Department of Electronics and Communication Engineering, Kalasalingam Academy of Research and Education, Krishnankoil, India; Department of Electronics and Communication Engineering, PMR Engineering College, India; Department of Mathematics, Amrita College of Engineering and Technology, Nagarcoil, India; Department of Computer Science and Engineering, Francis Xavier Engineering College, Tirunelveli, India; Department of Computer Science and Engineering, Anna University Regional Campus, Tirunelveli, India; Department of Computer Science and Engineering, GIET University, India | [h] VNU Information Technology Institute, Vietnam National University, Hanoi, Vietnam; Institute of Research and Development and School of Computer Science, Duy Tan University, Da Nang, Vietnam; VNU International University, Vietnam National University, Hanoi, Vietnam; Faculty of Information Technology, University of Technology-Logistics of Public Security, Bac Ninh, Vietnam;","Journal of Intelligent & Fuzzy Systems","IOS Press (bought by Sage November 2023)","India;Vietnam",2024-08-23,"10.3233/jifs-219433",0,"1/5/2023 0:00","10.3233/jifs-212214",0,"Compromised Peer Review;Investigation by Journal/Publisher;Investigation by Third Party;",NA,"2024"
62329,"A hybrid combined algorithm based on intelligent water drops and electromagnetism-like algorithms for fuzzy TSP1","(B/T) Computer Science;(B/T) Technology;","Department of Applied Mathematics, Faculty of Mathematics and Computer, Shahid Bahonar University of Kerman, Kerman, Iran;","Journal of Intelligent & Fuzzy Systems","IOS Press (bought by Sage November 2023)","Iran",2024-08-23,"10.3233/jifs-219433",0,"1/5/2023 0:00","10.3233/jifs-213121",0,"Compromised Peer Review;Investigation by Journal/Publisher;Investigation by Third Party;",NA,"2024"
62324,"A fast clustering algorithm for evolving fuzzy classifier based on samples mean","(B/T) Computer Science;(B/T) Data Science;(PHY) Mathematics;","Graduate Program in Mathematical and Computational Modeling, Federal Center of Technological Education of Minas Gerais, Belo Horizonte, MG, Brazil;","Journal of Intelligent & Fuzzy Systems","IOS Press (bought by Sage November 2023)","Brazil",2024-08-23,"10.3233/jifs-219433",0,"11/11/2022 0:00","10.3233/jifs-212831",0,"Compromised Peer Review;Investigation by Journal/Publisher;Investigation by Third Party;",NA,"2024"
62322,"A corpus-based Japanese translation model using fuzzy semantic optimal control technique","(B/T) Computer Science;(B/T) Technology;(SOC) Linguistics;","Zhijiang College of Zhejiang University of Technology, Shaoxing, China; Zhejiang Business College, Hangzhou, China;","Journal of Intelligent & Fuzzy Systems","IOS Press (bought by Sage November 2023)","China",2024-08-23,"10.3233/jifs-219433",0,"2/14/2024 0:00","10.3233/jifs-234575",0,"Compromised Peer Review;Investigation by Journal/Publisher;Investigation by Third Party;",NA,"2024"
62302,"Research on the Effective Fusion of Traditional Art and Old Street Culture Construction Based on Fuzzy Algorithm","(B/T) Computer Science;(HUM) Architecture;(HUM) Arts - General;","School of Art, Xi’an International Studies University, Xi’an 710119, China;","Security and Communication Networks","Hindawi","China",2023-10-04,"10.1155/2023/9830213",0,"9/19/2022 0:00","10.1155/2022/9616634",0,"Concerns/Issues about Data;Concerns/Issues about Results and/or Conclusions;Concerns/Issues about Referencing/Attributions;Concerns/Issues about Peer Review;Investigation by Journal/Publisher;Investigation by Third Party;Paper Mill;Computer-Aided Content or Computer-Generated Content;Unreliable Results and/or Conclusions;","See also: https://pubpeer.com/publications/D4B2701134D1E4CBF592327B7CE51B","2023"
62286,"Path Planning of a Multifunctional Elderly Intelligent Wheelchair Based on the Sensor and Fuzzy Bayesian Network Algorithm","(B/T) Computer Science;(B/T) Technology;(PHY) Engineering - General;(PHY) Mathematics;","Department of Preschool Education, Hefei Preschool Education College, Hefei 230001, China; Department of Electronic Technology, Lu’an Vocational Technical College, Lu’an 237100, China;","Journal of Sensors","Hindawi","China",2023-10-04,"10.1155/2023/9876185",0,"9/5/2022 0:00","10.1155/2022/8485644",0,"Computer-Aided Content or Computer-Generated Content;Concerns/Issues about Data;Concerns/Issues about Referencing/Attributions;Concerns/Issues about Results and/or Conclusions;Concerns/Issues about Peer Review;Investigation by Journal/Publisher;Investigation by Third Party;Paper Mill;Unreliable Results and/or Conclusions;","See also: https://pubpeer.com/publications/DD4B10301CCB31CEF1A71E4A395CBD","2023"
