"Record ID","Title","Subject","Institution","Journal","Publisher","Country","RetractionDate","RetractionDOI","RetractionPubMedID","OriginalPaperDate","OriginalPaperDOI","OriginalPaperPubMedID","Reason","Notes","Year"
42677,"Intelligent Big Data Analytics Model for Efficient Cardiac Disease Prediction with IoT Devices in WSN Using Fuzzy Rules","(B/T) Computer Science;(B/T) Data Science;(B/T) Technology;(HSC) Medicine - Cardiology;(HSC) Medicine - Cardiovascular;","School of Computing, SRM Institute of Science and Technology, Kattankulathur, Chennai, India","Wireless Personal Communications","Springer","India",2022-12-09,"10.1007/s11277-021-08788-3",0,"8/20/2021 0:00","10.1007/s11277-021-08788-3",0,"Compromised Peer Review;Investigation by Journal/Publisher;Rogue Editor;Unreliable Results and/or Conclusions;",NA,"2022"
42669,"Fuzzy comprehensive evaluation of classroom teaching quality of college teachers","(B/T) Data Science;(SOC) Education;","Guangdong University of Foreign Studies, Guangzhou, China;","The International Journal of Electrical Engineering & Education","SAGE Publications","China",2021-12-15,"10.1177/00207209211064046",0,"7/13/2020 0:00","10.1177/0020720920928540",0,"Compromised Peer Review;Investigation by Journal/Publisher;",NA,"2021"
42668,"Empirical analysis of the impact of financial development on the income gap between urban and rural residents in the context of large data using fuzzy Kmeans clustering algorithm","(B/T) Business - Economics;(B/T) Data Science;","School of Business Administration, Haikou University of Economics, Haikou, China;","The International Journal of Electrical Engineering & Education","SAGE Publications","China",2021-12-15,"10.1177/00207209211064046",0,"7/13/2020 0:00","10.1177/0020720920936837",0,"Compromised Peer Review;Investigation by Journal/Publisher;",NA,"2021"
42636,"Design of Heterogeneous Data Transmission System for Industrial Enterprises Based on Fuzzy Algorithm","(B/T) Computer Science;(B/T) Technology;","Industrial Internet Innovation Center (Shanghai) Co., Ltd, 200120, Shanghai, China","Wireless Personal Communications","Springer","China",2022-12-09,"10.1007/s11277-021-08703-w",0,"7/2/2021 0:00","10.1007/s11277-021-08703-w",0,"Compromised Peer Review;Investigation by Journal/Publisher;Rogue Editor;Unreliable Results and/or Conclusions;",NA,"2022"
42598,"Optimized Fuzzy System Dependent Trust Score for Mobile AdHoc Network","(B/T) Computer Science;(B/T) Technology;","Department of CSE, Anna University Regional Campus, Tirunelveli, Tamil Nadu, India","Wireless Personal Communications","Springer","India",2022-12-15,"10.1007/s11277-022-10118-0",0,"12/11/2020 0:00","10.1007/s11277-020-07984-x",0,"Compromised Peer Review;Investigation by Journal/Publisher;Rogue Editor;Unreliable Results and/or Conclusions;",NA,"2022"
42575,"Fuzzy Testing Method of CAN Bus of Charging Pile Based on Genetic Algorithm","(B/T) Computer Science;(B/T) Technology;","State Grid Hubei Electric Power Research Institute, Wuhan, China; School of Cyberspace Security, Huazhong University of Science and Technology, Wuhan, China;","Security and Communication Networks","Hindawi","China",2023-02-08,"10.1155/2023/9824295",0,"4/13/2022 0:00","10.1155/2022/2745175",0,"Concerns/Issues about Peer Review;Investigation by Journal/Publisher;Objections by Author(s);",NA,"2023"
42532,"Multi-level Dynamic Fuzzy Evaluation and BP Neural Network Method for Performance Evaluation of Chinese Private Enterprises","(B/T) Business - Economics;(B/T) Computer Science;(B/T) Technology;","School of Economics and Management, Nanjing University of Science and Technology, 210094, Nanjing, China","Wireless Personal Communications","Springer","China",2022-12-13,"10.1007/s11277-022-10131-3",0,"1/31/2018 0:00","10.1007/s11277-018-5298-0",0,"Compromised Peer Review;Investigation by Journal/Publisher;Rogue Editor;Unreliable Results and/or Conclusions;",NA,"2022"
42529,"Research on the Method of Music Content Analysis Based on Fuzzy Classification","(B/T) Computer Science;(HUM) Arts - Music;","School of Architecture and Design, China University of Mining and Technology, Xuzhou, China; School of Computer Science and Technology, China University of Mining and Technology, Xuzhou, China","Wireless Personal Communications","Springer","China",2022-12-13,"10.1007/s11277-022-10135-z",0,"1/23/2018 0:00","10.1007/s11277-018-5248-x",0,"Compromised Peer Review;Investigation by Journal/Publisher;Rogue Editor;Unreliable Results and/or Conclusions;",NA,"2022"
42525,"A Novel Approach Based on Sine Trigonometric Picture Fuzzy Aggregation Operators and Their Application in Decision Support System","(PHY) Mathematics;","Department of Mathematics, Abdul Wali Khan University, Mardan, Pakistan; Algebra and Applications Research Unit, Division of Computational Science, Faculty of Science, Prince of Songkla University, Hat Yai, Songkhla 90110, Thailand;","Journal of Mathematics","Hindawi","Pakistan;Thailand",2023-02-05,"10.1155/2023/9868343",0,"2/8/2021 0:00","10.1155/2021/8819517",0,"Compromised Peer Review;Investigation by Journal/Publisher;Objections by Author(s);",NA,"2023"
42370,"Tourism potential zone mapping using the fuzzy analytic hierarchy process and geographical information system: a study on Jharkhand State, India","(B/T) Business - Public Relations;(B/T) Computer Science;(B/T) Urban Planning;","Department of Geography, Cooch Behar Panchanan Barma University, Vivekananda Street, Cooch Behar, 736101, West Bengal, India;","Asia-Pacific Journal of Regional Science","Springer","India",2022-11-12,"10.1007/s41685-022-00237-8",0,"5/3/2022 0:00","10.1007/s41685-022-00237-8",0,"Concerns/Issues about Data;Concerns/Issues about Results and/or Conclusions;",NA,"2022"
42349,"A fuzzy logic control scheme for a solar photovoltaic system for a maximum power point tracker","(B/T) Computer Science;(PHY) Energy;(PHY) Engineering - Electrical;","Graphic Era University , Dehradoon , India; Department of Electrical Engineering, NITTTR , Chandigarh , India; Department of Electrical & Computer Engineering , Texas A&M University at Qatar , Doha , Qatar","International Journal of Sustainable Energy","Taylor and Francis","India;Qatar",2012-10-17,"10.1080/14786451.2012.738888",0,"4/19/2010 0:00","10.1080/14786461003802118",0,"Euphemisms for Plagiarism;Plagiarism of Image;Plagiarism of Text;",NA,"2012"
42316,"English Speech Feature Recognition-Based Fuzzy Algorithm and Artificial Intelligent","(B/T) Data Science;(SOC) Linguistics;","Faculty of International Languages, Qinggong College, North China University of Science and Technology, Tangshan, Hebei 064000, China;","Wireless Communications and Mobile Computing","Hindawi","China",2023-01-23,"10.1155/2023/9814680",0,"5/4/2022 0:00","10.1155/2022/4421520",0,"Concerns/Issues about Peer Review;Investigation by Journal/Publisher;",NA,"2023"
42309,"A Corpus-Based and Fuzzy Assessment-Based Study of Labels in Spoken English","(B/T) Data Science;(SOC) Linguistics;","College of Foreign Language, Xijing University, Xi’an, 710123 Shaanxi, China;","Wireless Communications and Mobile Computing","Hindawi","China",2023-01-22,"10.1155/2023/9830538",0,"3/12/2022 0:00","10.1155/2022/2511306",0,"Concerns/Issues about Peer Review;Investigation by Journal/Publisher;",NA,"2023"
42303,"Application of Improved Machine Learning and Fuzzy Algorithm in Educational Information Technology","(B/T) Data Science;(B/T) Technology;(SOC) Education;","Quzhou College of Technology, Quzhou, Zhejiang 324000, China; Jing Hengyi School of Education, Hangzhou Normal University, Hangzhou, Zhejiang 311121, China;","Security and Communication Networks","Hindawi","China",2023-01-22,"10.1155/2023/9825634",0,"5/21/2022 0:00","10.1155/2022/4912841",0,"Concerns/Issues about Peer Review;Investigation by Journal/Publisher;Objections by Author(s);",NA,"2023"
42263,"Multi-criteria-based approach for job scheduling in industry 4.0 in smart cities using fuzzy logic","(B/T) Business - Management;(B/T) Computer Science;(B/T) Data Science;","Department of Computer Science and Engineering, Kyung Hee University, Seoul, Korea; School of Information Technology and Engineering, Vellore Institute of Technology, Vellore, India; Department of Information Technology, Kongu Engineering College, Erode, India; Department of Computer and Information Sciences, Northumbria University, Newcastle upon Tyne, UK; The PNG University of Technology, Lae, Papua New Guinea; University of Oviedo, Oviedo, Spain;","Soft Computing","Springer","India;Papua New Guinea;South Korea;Spain;United Kingdom",2023-01-25,"10.1007/s00500-023-07869-8",0,"4/17/2021 0:00","10.1007/s00500-021-05765-7",0,"Compromised Peer Review;Rogue Editor;Unreliable Results and/or Conclusions;",NA,"2023"
42237,"Adaptive Temperature And Humidity Control System on Kumbung Mushroom using Fuzzy Neural Network Algorithm","(B/T) Computer Science;(BLS) Microbiology;(ENV) Environmental Sciences;","Department of Information Technology, State Polytechnic of Jember, Indonesia; Department of Agricultural Production, State Polytechnic of Jember, Indonesia; Department of Agribusiness Management, State Polytechnic of Jember, Indonesia;","IOP Conference Series: Earth and Environmental Science","IOP Publishing","Indonesia",2023-01-09,"10.1088/1755-1315/980/1/012070",0,"11/6/2021 0:00","10.1088/1755-1315/980/1/012063",0,"Investigation by Journal/Publisher;Computer-Aided Content or Computer-Generated Content;",NA,"2023"
42107,"Novel Concepts in Bipolar Fuzzy Graphs with Applications","(PHY) Mathematics;","Guangdong Polytechnic of Science and Technology, Guangzhou 510640, China; College of Information Science and Technology, Chengdu University of Technology, Chengdu 610059, China; Shenzhen Tourism College of Jinan University, Shenzhen 518053, China; Department of Mathematics University of Mazandaran, Babolsar, Iran;","Journal of Mathematics","Hindawi","China;Iran",2023-01-11,"10.1155/2023/9843601",0,"5/9/2022 0:00","10.1155/2022/8162474",0,"Concerns/Issues about Peer Review;Investigation by Journal/Publisher;Objections by Author(s);",NA,"2023"
41996,"Design of Fuzzy Aided Cognition System for International Economic and Trade Information under Supply Chain Management","(B/T) Business - Economics;(B/T) Business - Management;(B/T) Computer Science;","School of Economics and Management, Shangqiu Polytechnic, Shangqiu 476000, China; The Department of Industrial Engineering, International Ataturk Alatoo University, Kyrgyzstan;","Computational and Mathematical Methods in Medicine","Hindawi","China;Kyrgyzstan",2022-12-28,"10.1155/2022/9820789",36619790,"2/2/2022 0:00","10.1155/2022/6516175",35154359,"Concerns/Issues about Peer Review;Investigation by Journal/Publisher;Objections by Author(s);",NA,"2022"
41626,"Combined phase balancing and reconfiguration for unbalanced distribution system optimization through hybrid fuzzy-MFOA","(B/T) Computer Science;(PHY) Engineering - Electrical;","Kathir College of Engineering (EBOX Colleges), Coimbatore, India; Government College of Engineering, Salem, India","Journal of Ambient Intelligence and Humanized Computing","Springer - Nature Publishing Group","India",2022-10-30,"Unavailable",0,"3/8/2021 0:00","10.1007/s12652-021-02966-8",0,"Author Unresponsive;Concerns/Issues about Referencing/Attributions;Compromised Peer Review;Investigation by Journal/Publisher;Rogue Editor;Unreliable Results and/or Conclusions;",NA,"2022"
41558,"Heuristic ant colony and reliable fuzzy QoS routing for mobile ad hoc network","(B/T) Computer Science;(B/T) Technology;","SCOPE, VIT University, Vellore, TN, India;","Journal of Ambient Intelligence and Humanized Computing","Springer - Nature Publishing Group","India",2022-10-30,"Unavailable",0,"3/24/2021 0:00","10.1007/s12652-021-03140-w",0,"Author Unresponsive;Concerns/Issues about Referencing/Attributions;Compromised Peer Review;Investigation by Journal/Publisher;Objections by Author(s);Rogue Editor;Unreliable Results and/or Conclusions;",NA,"2022"
41474,"Application of software fuzzy adaptive speech task recognition in modern music online learning system","(B/T) Computer Science;(B/T) Technology;(HUM) Arts - Music;(SOC) Education;","School of Music, Wenzhou University, Wenzhou, 325000, Zhejiang, China","Journal of Ambient Intelligence and Humanized Computing","Springer - Nature Publishing Group","China",2022-10-14,"Unavailable",0,"4/9/2021 0:00","10.1007/s12652-021-03215-8",0,"Author Unresponsive;Concerns/Issues about Referencing/Attributions;Compromised Peer Review;Investigation by Journal/Publisher;Rogue Editor;Unreliable Results and/or Conclusions;",NA,"2022"
41461,"Research on Comprehensive Evaluation of Economic Management Performance Based on Improved Fuzzy Clustering Algorithm","(B/T) Business - Economics;(B/T) Computer Science;","School of Economics and Management, University of Chinese Academy of Sciences, Beijing 201802105, China;","Security and Communication Networks","Hindawi","China",2022-12-07,"10.1155/2022/9843736",0,"3/8/2022 0:00","10.1155/2022/8578138",0,"Concerns/Issues about Peer Review;Investigation by Journal/Publisher;",NA,"2022"
41418,"Exploring the Fuzzy Integrated Assessment of College Students’ Education for Innovative Entrepreneurship under the Background of Internet+","(B/T) Business - General;(B/T) Technology;(SOC) Education;","Admissions Office, Jiangsu Second Normal University, Nanjing, China; Student Affairs Office, Beijing City University, Beijing, China; School of Economics and Management, Huaibei Normal University, Huaibei, China;","Security and Communication Networks","Hindawi","China",2022-11-29,"10.1155/2022/9761927",0,"5/28/2022 0:00","10.1155/2022/4339772",0,"Concerns/Issues about Peer Review;Investigation by Journal/Publisher;Objections by Author(s);",NA,"2022"
41266,"Research on enterprise information capability evaluation based on fuzzy inference system","(B/T) Business - General;(B/T) Computer Science;","Business School of Sichuan University, Chengdu, China;","Information Systems and e-Business Management","Springer","China",2022-11-14,"10.1007/s10257-022-00595-y",0,"1/17/2019 0:00","10.1007/s10257-018-00395-3",0,"Concerns/Issues about Referencing/Attributions;Compromised Peer Review;Rogue Editor;Unreliable Results and/or Conclusions;",NA,"2022"
41174,"Decentralized event-triggering passive control of networked T-S fuzzy systems","(B/T) Computer Science;","Institute of Automation, Faculty of Mechanical Engineering and Automation, Zhejiang Sci-Tech University, Hangzhou, 310018, China; School of Electrical & Electronic Engineering, The University of Adelaide, Adelaide, SA 5005, Australia;","IEEE Transactions on Fuzzy Systems","IEEE: Institute of Electrical and Electronics Engineers","Australia;China",2015-07-08,"10.1109/TFUZZ.2015.2453394",0,"7/8/2015 0:00","10.1109/TFUZZ.2015.2453394",0,"Date of Article and/or Notice Unknown;Euphemisms for Plagiarism;Plagiarism of/in Article;","date of retraction unknown, html page overwrite;","2015"
41101,"Contourlet transform and adaptive neuro-fuzzy strategy–based color image watermarking","(B/T) Computer Science;(B/T) Technology;","Sri Krishna College of Engineering and Technology, Coimbatore, India; Department of Electronics and Communication Engineering, K.S.R. College of Engineering, Tiruchengode, India;","Measurement and Control","SAGE Publications","India",2022-10-11,"10.1177/00202940221126035",0,"1/6/2020 0:00","10.1177/0020294019878873",0,"Concerns/Issues about Third Party Involvement;Compromised Peer Review;",NA,"2022"
41001,"Prediction and Analysis of the Quality of Multimedia Professional Talents Combining Multiobjective Data Fuzzy Evolution","(B/T) Business - Management;(B/T) Computer Science;(B/T) Technology;","School of Architecture and Materials, Chongqing College of Electronic Engineering, Chongqing 401331, China; College of Geography and Tourism, Chongqing Normal University, Chongqing 401331, China;","Advances in Multimedia","Hindawi","China",2022-11-22,"10.1155/2022/9832136",0,"9/3/2021 0:00","10.1155/2021/1623076",0,"Concerns/Issues about Peer Review;Investigation by Journal/Publisher;",NA,"2022"
40876,"Fuzzy-Model-Based Sliding Mode Control of Nonlinear Descriptor Systems","(B/T) Computer Science;(PHY) Engineering - Electrical;","School of Aeronautics and Astronautics, Shanghai Jiao Tong University, Shanghai, China; Department of Mechanical Engineering, Politecnico di Milano, Milan, Italy; School of Electrical Engineering and Information, Anhui University of Technology, Ma’anshan, China; School of Electronic and Electrical Engineering, Shanghai University of Engineering Science, Shanghai, China; College of Information Science and Engineering, Yanshan University, Qinhuangdao, China","IEEE Transactions on Cybernetics","IEEE: Institute of Electrical and Electronics Engineers","China;Italy",2022-11-20,"10.1109/TCYB.2018.2842920",0,"6/20/2018 0:00","10.1109/TCYB.2018.2842920",29994144,"Breach of Policy by Author;Concerns/Issues about Referencing/Attributions;Date of Article and/or Notice Unknown;","date of retraction unknown, html page overwrite, date estimated from notifications; Hamid Reza Karimi named responsible for breach of policy;","2022"
40875,"A Novel Robust Fuzzy Integral Sliding Mode Control for Nonlinear Semi-Markovian Jump T–S Fuzzy Systems","(B/T) Computer Science;(PHY) Engineering - Electrical;","Department of Mechanical Engineering, Politecnico di Milano, Milan, Italy; Department of Mathematics, Harbin Institute of Technology, Weihai, China; School of Mathematical Sciences, Ocean University of China, Qingdao, China;","IEEE Transactions on Fuzzy Systems","IEEE: Institute of Electrical and Electronics Engineers","China;Italy",2022-11-20,"10.1109/TFUZZ.2018.2838552",0,"5/21/2018 0:00","10.1109/TFUZZ.2018.2838552",0,"Breach of Policy by Author;Concerns/Issues about Referencing/Attributions;Date of Article and/or Notice Unknown;","date of retraction unknown, html page overwrite, date estimated from notifications; Hamid Reza Karimi named responsible for breach of policy;","2022"
40874,"Sliding Mode Control of Fuzzy Singularly Perturbed Systems With Application to Electric Circuit","(B/T) Computer Science;(PHY) Engineering - Electrical;","School of Electronic and Electrical Engineering, Shanghai University of Engineering Science, Shanghai, China; Research Institute of Intelligent Control and Systems, Harbin Institute of Technology, Harbin, China; Department of Mechanical Engineering, Politecnico di Milano, Milan, Italy; School of Electrical Engineering and Information, Anhui University of Technology, Ma’anshan, China;","IEEE Transactions on Systems, Man, and Cybernetics: Systems","IEEE: Institute of Electrical and Electronics Engineers","China;Italy",2022-11-20,"10.1109/TSMC.2017.2720968",0,"8/24/2017 0:00","10.1109/TSMC.2017.2720968",0,"Breach of Policy by Author;Concerns/Issues about Referencing/Attributions;Date of Article and/or Notice Unknown;","date of retraction unknown, html page overwrite, date estimated from notifications; Hamid Reza Karimi named responsible for breach of policy;","2022"
40872,"Adaptive Control of Nonlinear Semi-Markovian Jump T–S Fuzzy Systems With Immeasurable Premise Variables via Sliding Mode Observer","(B/T) Computer Science;","Department of Mathematical Sciences, Ocean University of China, Qingdao, China; Department of Mechanical Engineering, Politecnico di Milano, Milan, Italy; School of Mathematics, Harbin Institute of Technology Weihai, Weihai, China;","IEEE Transactions on Cybernetics","IEEE: Institute of Electrical and Electronics Engineers","China;Italy",2022-11-20,"10.1109/TCYB.2018.2874166",0,"10/21/2018 0:00","10.1109/TCYB.2018.2874166",30346300,"Breach of Policy by Author;Concerns/Issues about Referencing/Attributions;Date of Article and/or Notice Unknown;",NA,"2022"
40871,"An Improved Result on Exponential Stabilization of Sampled-Data Fuzzy Systems","(B/T) Computer Science;","School of Aeronautics and Astronautics, Shanghai Jiao Tong University, Shanghai, China; Department of Mechanical Engineering, Politecnico di Milano, Milan, Italy; Department of Informatics, King's College London, London, U. K; School of Electrical Engineering and Information, Anhui University of Technology, Maanshan, China;","IEEE Transactions on Fuzzy Systems","IEEE: Institute of Electrical and Electronics Engineers","Cook Islands;Italy;United Kingdom",2022-11-20,"10.1109/TFUZZ.2018.2852281",0,"7/2/2018 0:00","10.1109/TFUZZ.2018.2852281",0,"Breach of Policy by Author;Concerns/Issues about Referencing/Attributions;Date of Article and/or Notice Unknown;","date of retraction unknown, html page overwrite, date estimated from notifications; Hamid Reza Karimi named responsible for breach of policy;","2022"
40870,"Fuzzy-Affine-Model-Based Memory Filter Design of Nonlinear Systems With Time-Varying Delay","(B/T) Computer Science;","State Key Laboratory of Robotics and Systems, Harbin Institute of Technology, China; Department of Mechanical Engineering, Politecnico di Milano, Milan, Italy;","IEEE Transactions on Fuzzy Systems","IEEE: Institute of Electrical and Electronics Engineers","China;Italy",2022-11-20,"10.1109/TFUZZ.2017.2686352",0,"3/27/2017 0:00","10.1109/TFUZZ.2017.2686352",0,"Breach of Policy by Author;Concerns/Issues about Referencing/Attributions;Date of Article and/or Notice Unknown;","date of retraction unknown, html page overwrite, date estimated from notifications; Hamid Reza Karimi named responsible for breach of policy;","2022"
40869,"Reliable Output Feedback Control of Discrete-Time Fuzzy Affine Systems With Actuator Faults","(B/T) Computer Science;","Research Institute of Intelligent Control and Systems, Harbin Institute of Technology, P. R. China; Department of Mechanical Engineering, Politecnico di Milano, Italy;","IEEE Transactions on Circuits and Systems I: Regular Papers","IEEE: Institute of Electrical and Electronics Engineers","China;Italy",2022-11-20,"10.1109/TCSI.2016.2605685",0,"12/20/2016 0:00","10.1109/TCSI.2016.2605685",0,"Breach of Policy by Author;Concerns/Issues about Referencing/Attributions;Date of Article and/or Notice Unknown;","date of retraction unknown, html page overwrite, date estimated from notifications; Hamid Reza Karimi named responsible for breach of policy;","2022"
40868,"Dissipativity-Based Fuzzy Integral Sliding Mode Control of Continuous-Time T-S Fuzzy Systems","(B/T) Computer Science;(PHY) Engineering - Electrical;","School of Electronic and Electrical Engineering, Shanghai University of Engineering Science, Shanghai, China; School of Electrical Engineering and Information, Anhui University of Technology, Ma'anshan, China; Department of Mechanical Engineering, Politecnico di Milano, Milan, Italy; School of Aeronautics and Astronautics, Shanghai Jiao Tong University, Shanghai, China;","IEEE Transactions on Fuzzy Systems","IEEE: Institute of Electrical and Electronics Engineers","China;Italy",2022-11-20,"10.1109/TFUZZ.2017.2710952",0,"6/1/2017 0:00","10.1109/TFUZZ.2017.2710952",0,"Breach of Policy by Author;Concerns/Issues about Referencing/Attributions;Date of Article and/or Notice Unknown;","date of retraction unknown, html page overwrite, date estimated from notifications; Hamid Reza Karimi named responsible for breach of policy;","2022"
40821,"An innovative framework to forecast the best inventory management system module by hesitant fuzzy VQA-TOPSIS technique for textile industry","(HUM) Arts - General;","School of Computing, SASTRA Deemed University, Thanjavur, India; Data Science Research Group, School of Computing, DIT University, Dehradun, India; Department of Computer Science, College of Computer and Information Sciences, Majmaah University, Al Majmaah, 11952, Saudi Arabia; School of Computing, SASTRA Deemed University, Thanjavur, India;","The International Journal of Advanced Manufacturing Technology","Springer","India;Saudi Arabia",2022-11-09,"10.1007/s00170-022-09634-x",0,"7/29/2022 0:00","10.1007/s00170-022-09634-x",0,"Concerns/Issues about Referencing/Attributions;Compromised Peer Review;Rogue Editor;Unreliable Results and/or Conclusions;",NA,"2022"
40757,"An attribute studentized fuzzy interval-valued chart based on normalized transformation","(B/T) Computer Science;(B/T) Technology;","School of Mathematics and Statistics, Minnan Normal University, Zhangzhou, China; Jordan University of Science and Technology, Irbid, Jordan;","The International Journal of Electrical Engineering & Education","SAGE Publications","China;Jordan",2021-12-15,"10.1177/00207209211064046",0,"1/14/2021 0:00","10.1177/0020720920984005",0,"Concerns/Issues about Peer Review;Investigation by Journal/Publisher;Updated to Retraction;",NA,"2021"
40445,"Validation of portfolio allocation in NPD: fuzzy-TOPSIS and COPRAS-grey approach","(B/T) Computer Science;(PHY) Engineering - General;","Mechanical Engineering Department, Goa College of Engineering, Farmagudi, Ponda, Goa, 403401, India;","International Journal of System Assurance Engineering and Management","Springer","India",2022-10-11,"10.1007/s13198-022-01781-4",0,"8/12/2020 0:00","10.1007/s13198-020-01024-4",0,"Concerns/Issues about Referencing/Attributions;Compromised Peer Review;Rogue Editor;Unreliable Results and/or Conclusions;",NA,"2022"
